{
  "schema_version": "1.0.0",
  "paper_id": "paper-2024-a163",
  "source": {
    "path": "C:\\Users\\28962\\Desktop\\数模\\数学建模仓库\\2024年高教社杯全国大学生数学建模竞赛优秀论文\\A163.pdf",
    "sha256": "4aa03ee03272bdbc49daf6ea64bfa155664faea71bf438591558d6d4085dc111",
    "parser": "pymupdf-ocr",
    "parsed_at": "2026-09-04T17:32:37+00:00",
    "normalized_markdown": "C:\\Users\\28962\\Desktop\\数模\\数学建模仓库\\论文\\24\\A163-基于几何模型的板凳龙运动路径问题\\workflow\\parsed\\normalized_paper.md",
    "structure_json": "C:\\Users\\28962\\Desktop\\数模\\数学建模仓库\\论文\\24\\A163-基于几何模型的板凳龙运动路径问题\\workflow\\parsed\\paper_structure.json"
  },
  "bibliographic": {
    "title": "基于几何模型的板凳龙运动路径问题",
    "authors": [],
    "year": 2024,
    "competition": "高教社杯全国大学生数学建模竞赛",
    "award": "优秀论文",
    "problem_id": "A",
    "abstract": "“ 极凳龙 “ 是我国浙闻地区的一项元宵节习俗 , 村民们将极凳首尾相连组成长龙 , 龙头在前领头 , 龙身龙尾祖随盘旋。 在保证舜龙队能够自如地盘入和盘出的情况下 , 盘 龙所需要的面积越小、 行进速度越快 , 则观觉性越好。 本文将盘龙过程抽象为数学模 型 , 在各板凳数据已知的条件下研究不同螺距、 不同龙头行进速度时 , 各时刻下整个舞 舅艾〕窿jl麾】k誓′蕾J位壹薰1]董零】董' 为深入研究如何优化盗龙所需的面积和行进速度提供了有效的帮",
    "keywords": [],
    "language": "zh-CN"
  },
  "problem": {
    "background": "<!-- Modeling-Mastery normalized document | parser=pymupdf-ocr | source_sha256=4aa03ee03272bdbc49daf6ea64bfa155664faea71bf438591558d6d4085dc111 --> # 基于几何模型的板凳龙运动路径问题 <!-- generated-by: Modeling-Mastery/PyMuPDF-Tesseract-OCR --> <!-- MM_PAGE: 1 --> 基于几何模型的板凯龙运动路径问题 摘要 “ 极凳龙 “ 是我国浙闻地区的一项元宵节习俗 , 村民们将极凳首尾相连组成长龙 , 龙头在前领头 , 龙身龙尾祖随盘旋。 在保证舜龙队能够自如地盘入和盘出的情况下 , 盘 龙所需要的面积越小、 行进速度越快 , 则观觉性越好。 本文将盘龙过程抽象为数学模 型 , 在各板凳数据已知的条件下研究不同螺距、 不同龙头行进速度时 , 各时刻下整个舞 舅艾〕窿jl麾】k誓′蕾J位壹薰1]董零】董' 为深入研究如何优化盗龙所需的面积和行进速度提供了有效的帮 针对问题一 , 舞龙队沿一螺距已知的等距螺线顺时针盘入 , 各把手中心严格位于螺 线上。 本文将盘入螺线转化为极坐标方程 , 采用积分的方法建立起龙头前把手所处位置 与速度和时间的关系 , 得到其每个时刻的龙头前把手坐标。 后面本文采用建立位置选代 公式的方法 , 由龙头前把手位置 , 得到舞龙队各前把手位置。 为解决各时刻舞龙队各前 把手速度问题 , 本文根据得到的位置坐标 , 建立相邻两把手速度迭代公式。 结合已知的 龙头前把手恒定速度 , 本文求解出各个时刻整个舞龙队的位置和速度。 针对问题二 , 在舞龙队沿着螺线盘入的过程中 , 随着龙头前把手逐涧接近圆心 , 由 于螺距的限制 , 板凳之间可能",
    "overall_objective": "启发式模式未可靠抽取总体目标。",
    "subproblems": [
      {
        "id": "Q1",
        "statement": "离线启发式模式未可靠拆分子问题，请人工或使用 LLM 补全。",
        "task_types": [
          "unknown"
        ],
        "inputs": [],
        "outputs": [],
        "constraints": [],
        "evidence_ids": []
      }
    ]
  },
  "evidence": [
    {
      "id": "E-TEXT-P002-ecd10efef2",
      "kind": "text",
      "page": 2,
      "section": "基于几何模型的板凳龙运动路径问题",
      "label": "assumption",
      "locator": "char:2288-2343",
      "quote": "假设有一由 223 节板凳组成的板凳龙 , 其中第 1 节为龙头 , 接着 221 节龙身 , 最后 1 节",
      "char_start": 2288,
      "char_end": 2343,
      "content_hash": "ecd10efef2ed2644b23ac40c72ac39d84ae211abe7698be08b2ea0f0f9c43f2f",
      "provenance": "HEURISTIC",
      "confidence": 0.55
    },
    {
      "id": "E-TEXT-P008-54ae09b8ff",
      "kind": "text",
      "page": 8,
      "section": "基于几何模型的板凳龙运动路径问题",
      "label": "assumption",
      "locator": "char:7192-7234",
      "quote": "假设在树一时刻下 , 树一板凯 , 具前后把手中心距离为 !, 其前把手中心位置坐",
      "char_start": 7192,
      "char_end": 7234,
      "content_hash": "54ae09b8ff782c7f42f5134ead34e6b5b14bfd1a4eed95377a48995cf59a4d96",
      "provenance": "HEURISTIC",
      "confidence": 0.55
    },
    {
      "id": "E-TEXT-P008-90f9fcdac3",
      "kind": "text",
      "page": 8,
      "section": "基于几何模型的板凳龙运动路径问题",
      "label": "assumption",
      "locator": "char:7268-7287",
      "quote": "假设诙板凯后把手中心位置此时的升标",
      "char_start": 7268,
      "char_end": 7287,
      "content_hash": "90f9fcdac3b738cf92241ecedc740bc285b273b25ed7aed48b73544f96e1a08e",
      "provenance": "HEURISTIC",
      "confidence": 0.55
    },
    {
      "id": "E-TEXT-P008-6343865c8f",
      "kind": "text",
      "page": 8,
      "section": "基于几何模型的板凳龙运动路径问题",
      "label": "assumption",
      "locator": "char:7728-7751",
      "quote": "假设在某一时刻下 , 如图 4.9 所示 :",
      "char_start": 7728,
      "char_end": 7751,
      "content_hash": "6343865c8f2d0632489b708b34522142ed67ffaecaa8cd5ab797b9588b672e85",
      "provenance": "HEURISTIC",
      "confidence": 0.55
    },
    {
      "id": "E-TEXT-P011-413c86d0db",
      "kind": "text",
      "page": 11,
      "section": "基于几何模型的板凳龙运动路径问题",
      "label": "assumption",
      "locator": "char:10388-10433",
      "quote": "假设 { 时刻下龙头前把手中心位置坐标为 (zt,), 极角为万 4 , 根据问题一的位",
      "char_start": 10388,
      "char_end": 10433,
      "content_hash": "413c86d0db2506fc274a44f66c687df858602ca0b88f8e7bc7be316c30142107",
      "provenance": "HEURISTIC",
      "confidence": 0.55
    },
    {
      "id": "E-TEXT-P014-4f451e6f1c",
      "kind": "text",
      "page": 14,
      "section": "基于几何模型的板凳龙运动路径问题",
      "label": "assumption",
      "locator": "char:12763-12797",
      "quote": "假设两圆弧的半径比为 X 时 , 调头路径如图 4.16 所示 :",
      "char_start": 12763,
      "char_end": 12797,
      "content_hash": "4f451e6f1cbcd8df10aa71f17b3351ff2d5493070e5ce7ec0c3a5818664be589",
      "provenance": "HEURISTIC",
      "confidence": 0.55
    },
    {
      "id": "E-TEXT-P016-fb13d80732",
      "kind": "text",
      "page": 16,
      "section": "基于几何模型的板凳龙运动路径问题",
      "label": "assumption",
      "locator": "char:13919-13969",
      "quote": "假设树一时刻 , 某一板凤 , 其前后把手中心距离为 1, 其前把手中心位置坐标为 (ri,) 已",
      "char_start": 13919,
      "char_end": 13969,
      "content_hash": "fb13d80732f16d7bf2d143322d1b1cfb0b24495fe218cd213e7659acd6e127d8",
      "provenance": "HEURISTIC",
      "confidence": 0.55
    },
    {
      "id": "E-TEXT-P018-4731642749",
      "kind": "text",
      "page": 18,
      "section": "基于几何模型的板凳龙运动路径问题",
      "label": "assumption",
      "locator": "char:14894-14943",
      "quote": "假设树一时刻 , 某一板凳 , 其前后把手中心距离为 !, 其前把手中心位置坐标为 (z,) 已",
      "char_start": 14894,
      "char_end": 14943,
      "content_hash": "47316427494afea26263ca266d75595a9f85925a38e321320908702e4770b6e5",
      "provenance": "HEURISTIC",
      "confidence": 0.55
    },
    {
      "id": "E-TEXT-P001-53401f021e",
      "kind": "text",
      "page": 1,
      "section": "基于几何模型的板凳龙运动路径问题",
      "label": "model",
      "locator": "char:544-583",
      "quote": "本文将盘入螺线转化为极坐标方程 , 采用积分的方法建立起龙头前把手所处位置",
      "char_start": 544,
      "char_end": 583,
      "content_hash": "53401f021ec7a54fddab85396b9f3f2ff81e8a6b72a86c7e3fce6d0316301f33",
      "provenance": "HEURISTIC",
      "confidence": 0.55
    },
    {
      "id": "E-TEXT-P001-6204b9f2b3",
      "kind": "text",
      "page": 1,
      "section": "基于几何模型的板凳龙运动路径问题",
      "label": "model",
      "locator": "char:989-1004",
      "quote": "进而采用几何方法 , 计算",
      "char_start": 989,
      "char_end": 1004,
      "content_hash": "6204b9f2b39fa64e3715e26923e74242d4408d5441153e99ef63123f54f52b1d",
      "provenance": "HEURISTIC",
      "confidence": 0.55
    },
    {
      "id": "E-TEXT-P001-ebc0a0f929",
      "kind": "text",
      "page": 1,
      "section": "基于几何模型的板凳龙运动路径问题",
      "label": "model",
      "locator": "char:1212-1255",
      "quote": "刻龙头前把手中心坐标位于调头空间内和谍头空间外的两个螺距 , 再使用十分法 , 精确",
      "char_start": 1212,
      "char_end": 1255,
      "content_hash": "ebc0a0f929e97701782eb8644825df1f8dae044522071b04c2e274ff658f919e",
      "provenance": "HEURISTIC",
      "confidence": 0.55
    },
    {
      "id": "E-TEXT-P003-aa87c0e325",
      "kind": "text",
      "page": 3,
      "section": "基于几何模型的板凳龙运动路径问题",
      "label": "model",
      "locator": "char:2744-2777",
      "quote": "通过建立合适的数学模型 , 求解出从 t = 0s 至 t =",
      "char_start": 2744,
      "char_end": 2777,
      "content_hash": "aa87c0e325f135791a86ae11c5cfe1ff87c96f09d450cfcb13a01037e059264d",
      "provenance": "HEURISTIC",
      "confidence": 0.55
    },
    {
      "id": "E-TEXT-P005-80add7be90",
      "kind": "text",
      "page": 5,
      "section": "基于几何模型的板凳龙运动路径问题",
      "label": "model",
      "locator": "char:4795-4815",
      "quote": "再采用十分法 , 精确求解满足要求的",
      "char_start": 4795,
      "char_end": 4815,
      "content_hash": "80add7be907e900c4b50ed29c04bd2ac518a6e031f612b96ca182f3573e83796",
      "provenance": "HEURISTIC",
      "confidence": 0.55
    },
    {
      "id": "E-TEXT-P006-d77b0130da",
      "kind": "text",
      "page": 6,
      "section": "基于几何模型的板凳龙运动路径问题",
      "label": "model",
      "locator": "char:5772-5810",
      "quote": "最后根据问题一中的思路 , 采用关联速度的方法 , 根据前把手的速度得到",
      "char_start": 5772,
      "char_end": 5810,
      "content_hash": "d77b0130dab851e2dfce6f03dec06872b3dbeb16ad619e0ec1e4a7feee662471",
      "provenance": "HEURISTIC",
      "confidence": 0.55
    },
    {
      "id": "E-TEXT-P006-e317ec4a14",
      "kind": "text",
      "page": 6,
      "section": "基于几何模型的板凳龙运动路径问题",
      "label": "model",
      "locator": "char:6125-6142",
      "quote": "再采用十分法 , 利用编程求解",
      "char_start": 6125,
      "char_end": 6142,
      "content_hash": "e317ec4a14b45d9e2dda1ba1462846ee6a0b3d3294f7d6045173e49f644c6d60",
      "provenance": "HEURISTIC",
      "confidence": 0.55
    },
    {
      "id": "E-TEXT-P008-d30f78829e",
      "kind": "text",
      "page": 8,
      "section": "基于几何模型的板凳龙运动路径问题",
      "label": "model",
      "locator": "char:7436-7487",
      "quote": "联立式 (1)、 式 (2), 采用二分求零点的方法可解得 p2 与仪 , 进而通过坐标转化公式 :",
      "char_start": 7436,
      "char_end": 7487,
      "content_hash": "d30f78829e60d9e383e404bfb1ca59c5eac6644b50b45309ad73ecf36df84a0d",
      "provenance": "HEURISTIC",
      "confidence": 0.55
    },
    {
      "id": "E-TEXT-P013-799d0604ed",
      "kind": "text",
      "page": 13,
      "section": "基于几何模型的板凳龙运动路径问题",
      "label": "model",
      "locator": "char:12158-12202",
      "quote": "通过问题一、 问题二中建立的模型 , 不难发现 , 在其他条件不变的情况下 , 每个时",
      "char_start": 12158,
      "char_end": 12202,
      "content_hash": "799d0604edac1b639a79906b61d1d3f1f9c40a35c541ea599bd53ca40efbf2a2",
      "provenance": "HEURISTIC",
      "confidence": 0.55
    },
    {
      "id": "E-TEXT-P024-1afc0a3c72",
      "kind": "text",
      "page": 24,
      "section": "基于几何模型的板凳龙运动路径问题",
      "label": "model",
      "locator": "char:17214-17248",
      "quote": "中心昔中心对称 , 故可采用类似于情况一的方法求解后把手中心的坐标。",